{
  "schemaVersion": 1,
  "catalogVersion": "2026.08.08.1",
  "updatedAt": "2026-08-08T00:00:00.000Z",
  "carriers": [
    {
      "id": "ctexcel-uk",
      "displayName": "CTExcel UK",
      "operatorName": "CTExcel",
      "countryCode": "GB",
      "countryName": "英国",
      "flag": "🇬🇧",
      "timeZoneId": "Europe/London",
      "websiteUrl": "https://www.ctexcel.com/uk/guaranteeNum",
      "aliases": ["China Telecom Europe", "中国电信欧洲"],
      "keepAlive": {
        "cycleDays": 90,
        "qualifyingActions": [
          "mobileData",
          "sms",
          "call",
          "topUp",
          "planPurchase"
        ],
        "summary": "连续 90 天未使用任何 CTExcel 服务，号码可能被终止。",
        "constraints": [
          {
            "kind": "firstUse",
            "title": "激活后首次使用",
            "details": "英国卡激活后需在英国或欧盟产生使用记录。",
            "withinDays": 10,
            "regions": ["英国", "欧盟"]
          },
          {
            "kind": "afterPlanExpiry",
            "title": "短期旅行套餐续订",
            "details": "短期回国或欧洲套餐到期后若未续订，号码会被终止。",
            "withinDays": 15
          },
          {
            "kind": "paidRetention",
            "title": "付费保号服务（可选）",
            "details": "可按 £1/月进入休眠保号；需一次性预付所选期间，最短按一个自然月计费。"
          }
        ],
        "presetId": "ctexcel-uk",
        "sourceLabel": "CTExcel UK 官网保号服务与 eSIM FAQ",
        "sourceUrl": "https://www.ctexcel.com/uk/guaranteeNum",
        "sourceCheckedAt": "2026-08-08T00:00:00.000Z"
      }
    },
    {
      "id": "esim-gg-estonia",
      "displayName": "eSIM.gg +372",
      "operatorName": "eSIM.gg",
      "countryCode": "EE",
      "countryName": "爱沙尼亚",
      "flag": "🇪🇪",
      "timeZoneId": "Europe/Tallinn",
      "websiteUrl": "https://esim.gg/support/faq",
      "aliases": ["eSIM.GG", "Elisa Prepaid", "+372"],
      "keepAlive": {
        "cycleDays": 365,
        "qualifyingActions": ["mobileData", "call", "sms", "topUp"],
        "summary": "每 365 天至少完成一次有效动作；365 天无有效动作，号码可能被释放。",
        "constraints": [],
        "presetId": "esim-gg-estonia",
        "sourceLabel": "eSIM.gg 官方 FAQ 与号码有效期说明",
        "sourceUrl": "https://esim.gg/support/faq",
        "sourceCheckedAt": "2026-08-08T00:00:00.000Z"
      }
    }
  ]
}
